{
  "assumptions": [
    {
      "claim": {
        "kind": "lt",
        "left": {
          "kind": "int",
          "value": 0
        },
        "right": {
          "id": "a",
          "kind": "var"
        }
      },
      "id": "ha",
      "scope": "root"
    }
  ],
  "goal": {
    "direction": "both",
    "domain": [],
    "expression": {
      "kind": "div",
      "left": {
        "kind": "add",
        "left": {
          "id": "x",
          "kind": "var"
        },
        "right": {
          "kind": "int",
          "value": 1
        }
      },
      "right": {
        "id": "a",
        "kind": "var"
      }
    },
    "kind": "limit",
    "point": {
      "kind": "int",
      "value": 0
    },
    "result": {
      "kind": "finite",
      "value": {
        "kind": "div",
        "left": {
          "kind": "int",
          "value": 1
        },
        "right": {
          "id": "a",
          "kind": "var"
        }
      }
    },
    "variable": "x"
  },
  "policy": {
    "accepted_axioms": [
      "propext",
      "Classical.choice",
      "Quot.sound"
    ],
    "allowed_rules": [
      "limit_algebra"
    ],
    "max_seconds": 10
  },
  "request_id": "limit-algebra-symbolic-denominator",
  "scopes": [
    {
      "binders": [],
      "id": "root",
      "parent": null
    }
  ],
  "steps": [
    {
      "claim": {
        "direction": "both",
        "domain": [],
        "expression": {
          "kind": "div",
          "left": {
            "kind": "add",
            "left": {
              "id": "x",
              "kind": "var"
            },
            "right": {
              "kind": "int",
              "value": 1
            }
          },
          "right": {
            "id": "a",
            "kind": "var"
          }
        },
        "kind": "limit",
        "point": {
          "kind": "int",
          "value": 0
        },
        "result": {
          "kind": "finite",
          "value": {
            "kind": "div",
            "left": {
              "kind": "int",
              "value": 1
            },
            "right": {
              "id": "a",
              "kind": "var"
            }
          }
        },
        "variable": "x"
      },
      "id": "proof",
      "parameters": {},
      "premises": [
        "ha"
      ],
      "rule": "limit_algebra",
      "scope": "root"
    }
  ],
  "variables": [
    {
      "id": "x",
      "type": "real"
    },
    {
      "id": "a",
      "type": "real"
    }
  ],
  "version": "0.1"
}
