{
  "assumptions": [],
  "goal": {
    "direction": "both",
    "domain": [],
    "expression": {
      "kind": "div",
      "left": {
        "kind": "sub",
        "left": {
          "kind": "add",
          "left": {
            "base": {
              "id": "x",
              "kind": "var"
            },
            "exponent": 2,
            "kind": "pow"
          },
          "right": {
            "kind": "mul",
            "left": {
              "kind": "int",
              "value": 3
            },
            "right": {
              "id": "x",
              "kind": "var"
            }
          }
        },
        "right": {
          "kind": "int",
          "value": 1
        }
      },
      "right": {
        "kind": "add",
        "left": {
          "id": "x",
          "kind": "var"
        },
        "right": {
          "kind": "int",
          "value": 1
        }
      }
    },
    "kind": "limit",
    "point": {
      "kind": "int",
      "value": 2
    },
    "result": {
      "kind": "finite",
      "value": {
        "kind": "int",
        "value": 3
      }
    },
    "variable": "x"
  },
  "policy": {
    "accepted_axioms": [
      "propext",
      "Classical.choice",
      "Quot.sound"
    ],
    "allowed_rules": [
      "limit_algebra"
    ],
    "max_seconds": 10
  },
  "request_id": "limit-algebra-basic",
  "scopes": [
    {
      "binders": [],
      "id": "root",
      "parent": null
    }
  ],
  "steps": [
    {
      "claim": {
        "direction": "both",
        "domain": [],
        "expression": {
          "kind": "div",
          "left": {
            "kind": "sub",
            "left": {
              "kind": "add",
              "left": {
                "base": {
                  "id": "x",
                  "kind": "var"
                },
                "exponent": 2,
                "kind": "pow"
              },
              "right": {
                "kind": "mul",
                "left": {
                  "kind": "int",
                  "value": 3
                },
                "right": {
                  "id": "x",
                  "kind": "var"
                }
              }
            },
            "right": {
              "kind": "int",
              "value": 1
            }
          },
          "right": {
            "kind": "add",
            "left": {
              "id": "x",
              "kind": "var"
            },
            "right": {
              "kind": "int",
              "value": 1
            }
          }
        },
        "kind": "limit",
        "point": {
          "kind": "int",
          "value": 2
        },
        "result": {
          "kind": "finite",
          "value": {
            "kind": "int",
            "value": 3
          }
        },
        "variable": "x"
      },
      "id": "proof",
      "parameters": {},
      "premises": [],
      "rule": "limit_algebra",
      "scope": "root"
    }
  ],
  "variables": [
    {
      "id": "x",
      "type": "real"
    }
  ],
  "version": "0.1"
}
