{
  "assumptions": [],
  "goal": {
    "expression": {
      "kind": "div",
      "left": {
        "kind": "int",
        "value": 1
      },
      "right": {
        "base": {
          "arg": {
            "id": "n",
            "kind": "var"
          },
          "kind": "cast_real"
        },
        "exponent": 2,
        "kind": "pow"
      }
    },
    "kind": "series_sum",
    "result": {
      "kind": "summable"
    },
    "variable": "n"
  },
  "policy": {
    "accepted_axioms": [
      "propext",
      "Classical.choice",
      "Quot.sound"
    ],
    "allowed_rules": [
      "series_p_series"
    ],
    "max_seconds": 10
  },
  "request_id": "series_p2_zero_shift_unsupported",
  "scopes": [
    {
      "binders": [],
      "id": "root",
      "parent": null
    }
  ],
  "steps": [
    {
      "claim": {
        "expression": {
          "kind": "div",
          "left": {
            "kind": "int",
            "value": 1
          },
          "right": {
            "base": {
              "arg": {
                "id": "n",
                "kind": "var"
              },
              "kind": "cast_real"
            },
            "exponent": 2,
            "kind": "pow"
          }
        },
        "kind": "series_sum",
        "result": {
          "kind": "summable"
        },
        "variable": "n"
      },
      "id": "series",
      "parameters": {},
      "premises": [],
      "rule": "series_p_series",
      "scope": "root"
    }
  ],
  "variables": [
    {
      "id": "n",
      "type": "nat"
    }
  ],
  "version": "0.1"
}
