{
  "version": "0.1",
  "request_id": "series_ratio_eventual_linear_geometric_summable",
  "variables": [
    {
      "id": "n",
      "type": "nat"
    }
  ],
  "scopes": [
    {
      "id": "root",
      "parent": null,
      "binders": []
    }
  ],
  "assumptions": [
    {
      "id": "h1",
      "scope": "root",
      "claim": {
        "kind": "exists",
        "binder": {
          "id": "eventuallyN",
          "type": "nat"
        },
        "body": {
          "kind": "forall",
          "binder": {
            "id": "k",
            "type": "nat"
          },
          "body": {
            "kind": "implies",
            "left": {
              "kind": "le",
              "left": {
                "kind": "var",
                "id": "eventuallyN"
              },
              "right": {
                "kind": "var",
                "id": "k"
              }
            },
            "right": {
              "kind": "le",
              "left": {
                "kind": "abs",
                "arg": {
                  "kind": "mul",
                  "left": {
                    "kind": "cast_real",
                    "arg": {
                      "kind": "add",
                      "left": {
                        "kind": "var",
                        "id": "k"
                      },
                      "right": {
                        "kind": "int",
                        "value": 2
                      }
                    }
                  },
                  "right": {
                    "kind": "pow_nat",
                    "base": {
                      "kind": "rat",
                      "numerator": 1,
                      "denominator": 2
                    },
                    "exponent": {
                      "kind": "add",
                      "left": {
                        "kind": "var",
                        "id": "k"
                      },
                      "right": {
                        "kind": "int",
                        "value": 1
                      }
                    }
                  }
                }
              },
              "right": {
                "kind": "mul",
                "left": {
                  "kind": "rat",
                  "numerator": 3,
                  "denominator": 4
                },
                "right": {
                  "kind": "abs",
                  "arg": {
                    "kind": "mul",
                    "left": {
                      "kind": "cast_real",
                      "arg": {
                        "kind": "add",
                        "left": {
                          "kind": "var",
                          "id": "k"
                        },
                        "right": {
                          "kind": "int",
                          "value": 1
                        }
                      }
                    },
                    "right": {
                      "kind": "pow_nat",
                      "base": {
                        "kind": "rat",
                        "numerator": 1,
                        "denominator": 2
                      },
                      "exponent": {
                        "kind": "var",
                        "id": "k"
                      }
                    }
                  }
                }
              }
            }
          }
        }
      }
    }
  ],
  "steps": [
    {
      "id": "series",
      "scope": "root",
      "claim": {
        "kind": "series_sum",
        "variable": "n",
        "expression": {
          "kind": "mul",
          "left": {
            "kind": "cast_real",
            "arg": {
              "kind": "add",
              "left": {
                "kind": "var",
                "id": "n"
              },
              "right": {
                "kind": "int",
                "value": 1
              }
            }
          },
          "right": {
            "kind": "pow_nat",
            "base": {
              "kind": "rat",
              "numerator": 1,
              "denominator": 2
            },
            "exponent": {
              "kind": "var",
              "id": "n"
            }
          }
        },
        "result": {
          "kind": "summable"
        }
      },
      "rule": "series_ratio_test",
      "premises": [
        "h1"
      ],
      "parameters": {}
    }
  ],
  "goal": {
    "kind": "series_sum",
    "variable": "n",
    "expression": {
      "kind": "mul",
      "left": {
        "kind": "cast_real",
        "arg": {
          "kind": "add",
          "left": {
            "kind": "var",
            "id": "n"
          },
          "right": {
            "kind": "int",
            "value": 1
          }
        }
      },
      "right": {
        "kind": "pow_nat",
        "base": {
          "kind": "rat",
          "numerator": 1,
          "denominator": 2
        },
        "exponent": {
          "kind": "var",
          "id": "n"
        }
      }
    },
    "result": {
      "kind": "summable"
    }
  },
  "policy": {
    "allowed_rules": [
      "series_ratio_test"
    ],
    "max_seconds": 10,
    "accepted_axioms": [
      "propext",
      "Classical.choice",
      "Quot.sound"
    ]
  }
}
