{
  "assumptions": [],
  "goal": {
    "expression": {
      "kind": "add",
      "left": {
        "condition": {
          "kind": "eq",
          "left": {
            "kind": "mod_nat",
            "left": {
              "id": "n",
              "kind": "var"
            },
            "right": {
              "kind": "int",
              "value": 3
            }
          },
          "right": {
            "kind": "int",
            "value": 0
          }
        },
        "else": {
          "condition": {
            "kind": "eq",
            "left": {
              "kind": "mod_nat",
              "left": {
                "id": "n",
                "kind": "var"
              },
              "right": {
                "kind": "int",
                "value": 3
              }
            },
            "right": {
              "kind": "int",
              "value": 1
            }
          },
          "else": {
            "kind": "int",
            "value": 2
          },
          "kind": "if",
          "then": {
            "kind": "int",
            "value": 1
          }
        },
        "kind": "if",
        "then": {
          "kind": "int",
          "value": 0
        }
      },
      "right": {
        "kind": "div",
        "left": {
          "kind": "int",
          "value": 2
        },
        "right": {
          "arg": {
            "kind": "add",
            "left": {
              "id": "n",
              "kind": "var"
            },
            "right": {
              "kind": "int",
              "value": 2
            }
          },
          "kind": "cast_real"
        }
      }
    },
    "kind": "sequence_limit",
    "result": {
      "kind": "no_finite_limit"
    },
    "variable": "n"
  },
  "policy": {
    "accepted_axioms": [
      "propext",
      "Classical.choice",
      "Quot.sound"
    ],
    "allowed_rules": [
      "sequence_elementary_divergence"
    ],
    "max_seconds": 10
  },
  "request_id": "sequence-periodic-mod3-vanishing-reciprocal-no-finite",
  "scopes": [
    {
      "id": "root",
      "parent": null
    }
  ],
  "steps": [
    {
      "claim": {
        "expression": {
          "kind": "add",
          "left": {
            "condition": {
              "kind": "eq",
              "left": {
                "kind": "mod_nat",
                "left": {
                  "id": "n",
                  "kind": "var"
                },
                "right": {
                  "kind": "int",
                  "value": 3
                }
              },
              "right": {
                "kind": "int",
                "value": 0
              }
            },
            "else": {
              "condition": {
                "kind": "eq",
                "left": {
                  "kind": "mod_nat",
                  "left": {
                    "id": "n",
                    "kind": "var"
                  },
                  "right": {
                    "kind": "int",
                    "value": 3
                  }
                },
                "right": {
                  "kind": "int",
                  "value": 1
                }
              },
              "else": {
                "kind": "int",
                "value": 2
              },
              "kind": "if",
              "then": {
                "kind": "int",
                "value": 1
              }
            },
            "kind": "if",
            "then": {
              "kind": "int",
              "value": 0
            }
          },
          "right": {
            "kind": "div",
            "left": {
              "kind": "int",
              "value": 2
            },
            "right": {
              "arg": {
                "kind": "add",
                "left": {
                  "id": "n",
                  "kind": "var"
                },
                "right": {
                  "kind": "int",
                  "value": 2
                }
              },
              "kind": "cast_real"
            }
          }
        },
        "kind": "sequence_limit",
        "result": {
          "kind": "no_finite_limit"
        },
        "variable": "n"
      },
      "id": "seq",
      "parameters": {},
      "premises": [],
      "rule": "sequence_elementary_divergence",
      "scope": "root"
    }
  ],
  "variables": [
    {
      "id": "n",
      "type": "nat"
    }
  ],
  "version": "0.1"
}
